{
  "$schema": "https://json-schema.org/draft/2020-12/schema",
  "$id": "https://ninjapaw.github.io/pawprint/schema/deploy.config.schema.json",
  "title": "Pawprint deployment configuration",
  "description": "Validates both config/deploy.defaults.json (upstream-owned, never edited by adopters) and config/deploy.config.json (adopter-owned overrides). Both files share this shape; every field is optional so an override file may be minimal. Resolution order is builtin < defaults file < override file < environment variable < CLI flag.",
  "type": "object",
  "required": ["configVersion"],
  "additionalProperties": false,

  "properties": {
    "configVersion": {
      "description": "Schema contract version. A major mismatch is a hard failure; run 'pawprint config migrate' to upgrade.",
      "type": "string",
      "pattern": "^\\d+\\.\\d+\\.\\d+$"
    },

    "$schema": { "type": "string" },

    "project": {
      "type": "object",
      "additionalProperties": false,
      "properties": {
        "name": { "type": "string" },
        "slug": { "type": "string", "pattern": "^[a-z0-9][a-z0-9-]{1,62}$" },
        "author": { "type": "string" },
        "organization": { "type": "string" },
        "license": { "type": "string" },
        "copyright": { "type": "string" },
        "repository": { "type": "string", "format": "uri" },
        "support": { "type": "string", "format": "uri" },
        "disclaimer": { "type": "string" }
      }
    },

    "defaults": { "$ref": "#/$defs/settings" },

    "environments": {
      "description": "Per-environment overrides layered on top of defaults. Keys are environment names; 'dev' and 'prod' are conventional.",
      "type": "object",
      "minProperties": 1,
      "propertyNames": { "pattern": "^[a-z][a-z0-9-]{0,31}$" },
      "additionalProperties": { "$ref": "#/$defs/environment" }
    }
  },

  "$defs": {
    "noSecretKeys": {
      "description": "Configuration files are committed to source control. Secret-shaped keys are rejected outright; runtime secrets belong in Key Vault, pipeline identity in GitHub Environment variables. JSON Schema uses ECMA-262 regex with no inline case-insensitive flag, so this pattern covers the conventional camelCase and snake_case spellings. The resolver additionally applies a case-insensitive check and produces the actionable error message.",
      "propertyNames": {
        "not": {
          "pattern": "([Pp]assword|[Pp]asswd|[Ss]ecret|[Aa]pi[_]?[Kk]ey|[Cc]lient[_]?[Ss]ecret|[Tt]oken|[Cc]redential|[Cc]onnection[_]?[Ss]tring|[Pp]rivate[_]?[Kk]ey|[Pp]fx)"
        }
      }
    },

    "connectors": {
      "description": "Which connectors are enabled and at which permission tier. Tiers are cumulative and defined in config/connectors.catalog.json. Choose the lowest tier that unlocks what you actually need.",
      "type": "object",
      "additionalProperties": false,
      "properties": {
        "microsoft365": { "$ref": "#/$defs/tierChoice" },
        "azure": { "$ref": "#/$defs/tierChoice" },
        "github": { "$ref": "#/$defs/tierChoice" }
      }
    },

    "tierChoice": {
      "type": "string",
      "enum": ["none", "read", "write", "admin"],
      "default": "none"
    },

    "approvedSubscriptions": {
      "description": "Allowlist of subscription ids Pawprint may deploy into. Enforced at preflight: a subscription absent from this list is refused before any resource is touched. Absent or empty means nothing is approved, so it fails closed.",
      "type": "array",
      "uniqueItems": true,
      "items": {
        "type": "string",
        "pattern": "^[0-9a-fA-F]{8}-[0-9a-fA-F]{4}-[0-9a-fA-F]{4}-[0-9a-fA-F]{4}-[0-9a-fA-F]{12}$"
      }
    },

    "sinks": {
      "description": "Where emitted pawprints are written. JSON is always the on-the-wire format; sinks decide durability. Multiple sinks may be active at once.",
      "type": "object",
      "additionalProperties": false,
      "properties": {
        "file": {
          "description": "Local filesystem. Always available, including air-gapped. Not durable beyond the machine.",
          "type": "object",
          "additionalProperties": false,
          "properties": {
            "enabled": { "type": "boolean", "default": true },
            "directory": { "type": "string", "default": "output" },
            "archive": {
              "description": "Keep timestamped copies of previous runs alongside the current one.",
              "type": "boolean",
              "default": true
            }
          }
        },
        "githubArtifact": {
          "description": "Upload as a workflow artifact. Convenient in CI but bounded by the repository retention window, so unsuitable as the system of record.",
          "type": "object",
          "additionalProperties": false,
          "properties": {
            "enabled": { "type": "boolean", "default": true },
            "retentionDays": { "type": "integer", "minimum": 1, "maximum": 400 }
          }
        },
        "azureBlob": {
          "description": "Durable evidence store. Recommended system of record. Write-once semantics are what make a pawprint evidence rather than a log, so immutability is enabled by default.",
          "type": "object",
          "additionalProperties": false,
          "required": ["enabled"],
          "properties": {
            "enabled": { "type": "boolean", "default": false },
            "accountName": {
              "type": "string",
              "pattern": "^[a-z0-9]{3,24}$"
            },
            "containerName": {
              "type": "string",
              "pattern": "^[a-z0-9][a-z0-9-]{2,62}$",
              "default": "pawprints"
            },
            "immutable": {
              "description": "Apply a time-based retention policy so a written pawprint cannot be altered or deleted before it expires.",
              "type": "boolean",
              "default": true
            },
            "retentionDays": {
              "description": "Immutability window. Choose to match your audit obligation; it cannot be shortened once locked.",
              "type": "integer",
              "minimum": 1,
              "maximum": 3650,
              "default": 365
            },
            "redactBeforeUpload": {
              "description": "Mask subscription, tenant, resource and operator identifiers before the pawprint leaves the runner.",
              "type": "boolean",
              "default": false
            }
          },
          "allOf": [
            {
              "if": { "properties": { "enabled": { "const": true } }, "required": ["enabled"] },
              "then": { "required": ["accountName"] }
            }
          ]
        }
      }
    },

    "admin": {
      "description": "Identity configuration for the setup wizard and admin console. The public pawprint viewer has no auth and no backend; this section does not apply to it.",
      "type": "object",
      "additionalProperties": false,
      "properties": {
        "mode": {
          "description": "entra: workforce tenant sign-in, recommended. local: generated credential bound to loopback, for air-gapped or no-Azure use. entra-external: CIAM tenant, advanced and generally discouraged for admin consoles.",
          "type": "string",
          "enum": ["entra", "local", "entra-external"],
          "default": "entra"
        },
        "tenantId": {
          "description": "Directory the admin console authenticates against. Empty means auto-detect the tenant bound to the subscription.",
          "type": "string",
          "pattern": "^$|^[0-9a-fA-F-]{36}$"
        },
        "clientId": {
          "description": "Application (client) ID of the admin app registration. Not a secret.",
          "type": "string",
          "pattern": "^$|^[0-9a-fA-F-]{36}$"
        },
        "authority": {
          "description": "Authority host. Workforce tenants use login.microsoftonline.com; external tenants use <tenant>.ciamlogin.com.",
          "type": "string"
        },
        "credential": {
          "description": "How the app proves its identity. Federated credentials and certificates are preferred; client secrets are discouraged and never stored in config.",
          "type": "string",
          "enum": ["federated", "certificate", "none"],
          "default": "federated"
        },
        "requireAssignment": {
          "description": "Only users or groups explicitly assigned to the application may sign in.",
          "type": "boolean",
          "default": true
        },
        "appRoles": {
          "description": "Role names expected in the token. Authorization decisions read these claims.",
          "type": "array",
          "items": { "type": "string", "enum": ["Pawprint.Admin", "Pawprint.Operator", "Pawprint.Reader"] }
        },
        "bindAddress": {
          "description": "Interface the local console binds to. Loopback is the default and changing it exposes the console to the network.",
          "type": "string",
          "default": "127.0.0.1"
        },
        "sessionMinutes": {
          "type": "integer",
          "minimum": 5,
          "maximum": 480,
          "default": 60
        },
        "github": {
          "description": "Optional GitHub App used to act on repositories. This is resource authorization, not a sign-in method.",
          "type": "object",
          "additionalProperties": false,
          "properties": {
            "enabled": { "type": "boolean", "default": false },
            "appId": { "type": "string" },
            "installationId": { "type": "string" },
            "enterpriseSlug": { "type": "string" }
          }
        }
      },
      "allOf": [
        {
          "if": { "properties": { "mode": { "const": "entra" } }, "required": ["mode"] },
          "then": { "required": ["tenantId", "clientId"] }
        }
      ]
    },

    "settings": {
      "type": "object",
      "$ref": "#/$defs/noSecretKeys",
      "properties": {
        "location": {
          "description": "Azure region. Impact: cold.",
          "type": "string",
          "pattern": "^[a-z0-9]+$"
        },
        "scenario": {
          "description": "Default scenario id to run.",
          "type": "string"
        },
        "scenarioCatalog": {
          "description": "Path or repository reference to the scenario catalog.",
          "type": "string"
        },
        "ttlHours": {
          "description": "Default lifetime for a run's resources before reaping. Impact: hot.",
          "type": "number",
          "exclusiveMinimum": 0,
          "maximum": 168
        },
        "teardownOnFailure": {
          "description": "Destroy provisioned resources when a run fails. Recommended true for ephemeral scenarios.",
          "type": "boolean"
        },
        "redactPawprint": {
          "description": "Mask subscription, tenant, resource and operator identifiers in the emitted pawprint.",
          "type": "boolean"
        },
        "registry": {
          "description": "Container registry for scenario images. 'ghcr' avoids provisioning an ACR.",
          "type": "string",
          "enum": ["ghcr", "acr", "none"]
        },
        "parameters": {
          "description": "Scenario parameter overrides, validated against the target scenario's own schema at preflight.",
          "type": "object",
          "$ref": "#/$defs/noSecretKeys"
        },
        "sinks": { "$ref": "#/$defs/sinks" },
        "admin": { "$ref": "#/$defs/admin" },
        "connectors": { "$ref": "#/$defs/connectors" },
        "approvedSubscriptions": { "$ref": "#/$defs/approvedSubscriptions" }
      }
    },

    "environment": {
      "type": "object",
      "$ref": "#/$defs/noSecretKeys",
      "properties": {
        "branch": {
          "description": "Git branch bound to this environment. Deploying from a mismatched branch is a hard failure.",
          "type": "string"
        },
        "githubEnvironment": {
          "description": "GitHub Environment name holding the OIDC identity variables.",
          "type": "string"
        },
        "subscriptionId": {
          "description": "MUST remain an empty string. The real value is supplied at runtime from the AZURE_SUBSCRIPTION_ID GitHub Environment variable, so a fork never commits a subscription identifier.",
          "const": ""
        },
        "location": { "type": "string", "pattern": "^[a-z0-9]+$" },
        "resourceGroup": {
          "description": "Resource group for this environment. Impact: cold.",
          "type": "string",
          "minLength": 1,
          "maxLength": 90
        },
        "ttlHours": { "type": "number", "exclusiveMinimum": 0, "maximum": 168 },
        "requireApproval": {
          "description": "Whether this environment expects a GitHub Environment protection rule. Advisory; enforced by GitHub, asserted at preflight.",
          "type": "boolean"
        },
        "parameters": {
          "type": "object",
          "$ref": "#/$defs/noSecretKeys"
        },
        "sinks": { "$ref": "#/$defs/sinks" },
        "admin": { "$ref": "#/$defs/admin" },
        "connectors": { "$ref": "#/$defs/connectors" },
        "approvedSubscriptions": { "$ref": "#/$defs/approvedSubscriptions" }
      }
    }
  }
}
